MariaDB [db_tokoparfum]> INSERT INTO admin(nik_admin,nama_admin,username_admin,password_admin,email_admin,notelp_admin) VALUES (0167976544336863,'Alexandria Felicia Seanne','senna','123','fgelicia@gmail.com',082285132960);
Query OK, 1 row affected (0.10 sec)

MariaDB [db_tokoparfum]> select * from admin;
+----------+-----------------+---------------------------+----------------+----------------+--------------------+--------------+
| id_admin | nik_admin       | nama_admin                | username_admin | password_admin | email_admin        | notelp_admin |
+----------+-----------------+---------------------------+----------------+----------------+--------------------+--------------+
|        1 | 167976544336863 | Alexandria Felicia Seanne | senna          | 123            | fgelicia@gmail.com |  82285132960 |
+----------+-----------------+---------------------------+----------------+----------------+--------------------+--------------+
1 row in set (0.02 sec)

MariaDB [db_tokoparfum]> ALTER TABEL admin ALTER COLUMN nik_admin varchar(16) not null;
ERROR 1064 (42000): You have an error in your SQL syntax; check the manual that corresponds to your MariaDB server version for the right syntax to use near 'TABEL admin ALTER COLUMN nik_admin varchar(16) not null' at line 1
MariaDB [db_tokoparfum]> ALTER TABLE admin
    -> CHANGE nik_admin nik_admin varchar(16) not null;
Query OK, 1 row affected (0.24 sec)
Records: 1  Duplicates: 0  Warnings: 0

MariaDB [db_tokoparfum]> select * from admin;
+----------+-----------------+---------------------------+----------------+----------------+--------------------+--------------+
| id_admin | nik_admin       | nama_admin                | username_admin | password_admin | email_admin        | notelp_admin |
+----------+-----------------+---------------------------+----------------+----------------+--------------------+--------------+
|        1 | 167976544336863 | Alexandria Felicia Seanne | senna          | 123            | fgelicia@gmail.com |  82285132960 |
+----------+-----------------+---------------------------+----------------+----------------+--------------------+--------------+
1 row in set (0.00 sec)

MariaDB [db_tokoparfum]> DELETE FROM admin where id_admin=1;
Query OK, 1 row affected (0.61 sec)

MariaDB [db_tokoparfum]> select * from admin;
Empty set (0.00 sec)

MariaDB [db_tokoparfum]> INSERT INTO admin(nik_admin,nama_admin,username_admin,password_admin,email_admin,notelp_admin) VALUES (0167976544336863,'Alexandria Felicia Seanne','senna','123','fgelicia@gmail.com',082285132960);
Query OK, 1 row affected (0.30 sec)

MariaDB [db_tokoparfum]> select * from admin;
+----------+-----------------+---------------------------+----------------+----------------+--------------------+--------------+
| id_admin | nik_admin       | nama_admin                | username_admin | password_admin | email_admin        | notelp_admin |
+----------+-----------------+---------------------------+----------------+----------------+--------------------+--------------+
|        2 | 167976544336863 | Alexandria Felicia Seanne | senna          | 123            | fgelicia@gmail.com |  82285132960 |
+----------+-----------------+---------------------------+----------------+----------------+--------------------+--------------+
1 row in set (0.00 sec)

MariaDB [db_tokoparfum]> UPDATE admin SET id_admin=1 WHERE id_admin = 2;
Query OK, 1 row affected (0.13 sec)
Rows matched: 1  Changed: 1  Warnings: 0

MariaDB [db_tokoparfum]> select * from admin;
+----------+-----------------+---------------------------+----------------+----------------+--------------------+--------------+
| id_admin | nik_admin       | nama_admin                | username_admin | password_admin | email_admin        | notelp_admin |
+----------+-----------------+---------------------------+----------------+----------------+--------------------+--------------+
|        1 | 167976544336863 | Alexandria Felicia Seanne | senna          | 123            | fgelicia@gmail.com |  82285132960 |
+----------+-----------------+---------------------------+----------------+----------------+--------------------+--------------+
1 row in set (0.00 sec)

MariaDB [db_tokoparfum]> desc admin;
+----------------+---------------+------+-----+---------+----------------+
| Field          | Type          | Null | Key | Default | Extra          |
+----------------+---------------+------+-----+---------+----------------+
| id_admin       | int(11)       | NO   | PRI | NULL    | auto_increment |
| nik_admin      | varchar(16)   | NO   |     | NULL    |                |
| nama_admin     | varchar(25)   | NO   |     | NULL    |                |
| username_admin | varchar(15)   | NO   |     | NULL    |                |
| password_admin | varchar(15)   | NO   |     | NULL    |                |
| email_admin    | varchar(25)   | NO   |     | NULL    |                |
| notelp_admin   | decimal(18,0) | NO   |     | NULL    |                |
+----------------+---------------+------+-----+---------+----------------+
7 rows in set (0.03 sec)

MariaDB [db_tokoparfum]> INSERT INTO pegawai(nik_pegawai,nama_pegawai,username_pegawai,password_pegawai,email_pegawai,notelp_pegawai) VALUES (6868776544336863,'Michael Araona Wily','michael','123','awee@gmail.com',082287893960);
Query OK, 1 row affected (0.01 sec)

MariaDB [db_tokoparfum]> select * from pegawai;
+------------+------------------+---------------------+------------------+------------------+----------------+----------------+
| id_pegawai | nik_pegawai      | nama_pegawai        | username_pegawai | password_pegawai | email_pegawai  | notelp_pegawai |
+------------+------------------+---------------------+------------------+------------------+----------------+----------------+
|          1 | 6868776544336863 | Michael Araona Wily | michael          | 123              | awee@gmail.com |    82287893960 |
+------------+------------------+---------------------+------------------+------------------+----------------+----------------+
1 row in set (0.00 sec)

MariaDB [db_tokoparfum]> INSERT INTO kategori(gender) VALUES ('Perempuan'),('Laki-laki');
Query OK, 2 rows affected (0.07 sec)
Records: 2  Duplicates: 0  Warnings: 0

MariaDB [db_tokoparfum]> select * from kategori;
+-------------+-----------+
| id_kategori | gender    |
+-------------+-----------+
|           1 | Perempuan |
|           2 | Laki-laki |
+-------------+-----------+
2 rows in set (0.00 sec)